{
  "activeModule": "sparePlanning",
  "airports": [
    "A"
  ],
  "basicMissions": [
    {
      "equipmentType": "J-15",
      "id": "basic-small",
      "missionId": "basic-small",
      "missionPhases": [
        {
          "durationMinutes": 30,
          "id": "phase-sortie",
          "name": "sortie",
          "sequence": 1
        }
      ],
      "name": "small sortie",
      "taskDurationMinutes": 30
    }
  ],
  "combatUnit": {
    "members": [
      {
        "aircraftNo": "J15-001",
        "airport": "A",
        "model": "J-15",
        "status": "ready"
      }
    ]
  },
  "components": [
    {
      "aircraftModel": "J-15",
      "failureDistribution": {
        "distributionType": "指数分布",
        "parameters": "lambda=0.01"
      },
      "id": "whole-aircraft",
      "kOutOfN": {
        "k": 1,
        "n": 1
      },
      "name": "whole aircraft",
      "productId": "product-whole-aircraft",
      "productType": "whole",
      "quantity": 1
    }
  ],
  "missionProfile": {
    "compositeTasks": [],
    "durationHours": 1,
    "name": "clean mission",
    "periodicTasks": []
  },
  "products": [
    {
      "id": "product-whole-aircraft",
      "kind": "whole",
      "model": "whole-aircraft",
      "name": "whole aircraft"
    }
  ],
  "project_id": "project-clean-aircraft-support-v1",
  "project_version": "project-v0.1",
  "scenarioId": "scenario-clean-aircraft-support-v1",
  "schema_version": "project-v0",
  "supportActivities": [
    {
      "activityCodes": [
        "job-1"
      ],
      "activityType": "corrective",
      "durationHours": 1,
      "id": "corrective",
      "planType": "修复性维修方案",
      "predecessors": {
        "job-1": []
      }
    }
  ],
  "supportActivityJobs": [
    {
      "activityCode": "job-1"
    }
  ],
  "supportNodes": [
    {
      "equipmentCapacity": 1,
      "id": "node-a",
      "inventory": {
        "product-whole-aircraft": 2
      },
      "name": "node A",
      "organizationNodeId": "node-a",
      "personnelCapacity": 1
    }
  ],
  "supportOrganization": {
    "relations": [],
    "runtimeMode": "vertical",
    "tree": {
      "children": [],
      "id": "node-a",
      "name": "node A",
      "serviceScope": {
        "aircraftModels": [],
        "airportIds": [],
        "productIds": [],
        "resourceTypes": []
      }
    }
  },
  "supportResources": [
    {
      "id": "node-a-personnel",
      "name": "crew",
      "organizationNodeId": "node-a",
      "quantity": 1,
      "supportNodeName": "node A",
      "type": "personnel"
    }
  ],
  "transportPolicies": []
}
